table_name,domain,referenced_by_code,migration_found,expected_columns,expected_indexes,expected_unique_constraints,expected_foreign_keys,expected_rls_enabled,expected_policies,current_provenance_status,risk_level,recommended_action
"refund_records","refunds","admin refunds/orders: read/insert","yes","id; order_id; return_request_id; amount; currency; status; provider; provider_reference; error_message; metadata; created_at; updated_at; completed_at","order_id,created_at; return_request_id,created_at; status,created_at","completed provider reference/idempotency uniqueness recommended","order_id -> orders(id); return_request_id -> return_requests(id)","yes","server-only","Created/dynamically hardened in migrations; item breakdown stored in metadata not refund_items","P0","Verify amount checks/FKs/idempotency, immutable completed records, snapshot metadata, and RLS/revokes"
"restock_alerts","inventory/CRM","public restock API insert; inventory/admin read/update","yes","id; product_slug; email; user_id; status; created_at; notified_at; last_attempt_at; last_error","status,product_slug,created_at","unique waiting product_slug+normalized email","user_id -> auth.users(id)","yes","server-only; public endpoint mediates insert","Created and dynamically hardened","P1","Verify email normalization uniqueness, status check, retention and RLS/revokes"
"return_request_attachments","returns/storage","returns/account/admin and validators: read/insert","yes","id; return_request_id; storage_bucket; storage_path; original_name; mime_type; file_size_bytes; created_at","return_request_id,created_at; storage_path","unique bucket+path recommended","return_request_id -> return_requests(id) on delete cascade","yes","own rows through return request; admin service access","Created 20260702 after blanket RLS migration; no table RLS/policy found","P0","Verify live RLS/grants/FK/index; align with return-attachments storage ownership policies"
"return_request_items","returns/refunds","returns/account/admin refund: read/insert","yes","id; return_request_id; order_item_id; product_id/slug; product_name_snapshot; sku_snapshot; quantity; reason; note; unit_price_snapshot (populated from paid unit price); refundable_amount; condition_status; created_at","return_request_id,created_at; order_item_id","prevent over-claim duplicates/quantities by business rule","return_request_id -> return_requests(id); order_item_id -> order_items(id)","yes","own rows through return request; admin service access","Created 20260702 after blanket hardening; no RLS/policy found","P0","Verify RLS/grants/FKs/checks; prove unit_price_snapshot/refundable_amount derive from order_items paid snapshots and enforce cumulative quantity integrity"
"return_requests","returns","returns/account/admin/cancellation: read/write","yes","id; order_id; user_id; customer_email; reason; status; customer_note; admin_note; refund_status; requested_items; requested_attachments; attachment_count; created_at; updated_at","order_id,status,created_at; user_id,created_at; lower(customer_email),created_at","one active request/order partial index (verify item-level semantics)","order_id -> orders(id); user_id -> auth.users(id)","yes","server-only or own select/insert through API","Created and dynamically hardened; later columns added","P0","Verify status enums, FKs, user index, RLS/revokes and active-request uniqueness semantics"
"return_status_events","returns/audit","returns/account/admin: read/insert","yes","id; return_request_id; old_status; new_status; event_type; actor_type; actor_id; note; metadata; created_at","return_request_id,created_at","event idempotency optional","return_request_id -> return_requests(id)","yes","own read through return; server-only insert","Created 20260702 after blanket hardening; no RLS/policy found","P0","Verify RLS/grants/FK/index and immutability"
"review_helpful","reviews","reviews API: read/insert/delete","out-of-band","id; review_id; user_id; created_at","review_id; user_id","unique(review_id,user_id)","review_id -> reviews(id); user_id -> auth.users(id)","yes","public aggregate/read only if needed; own insert/delete","Defined only in root reviews/schema SQL; blanket hardening is apply-order dependent","P0","Promote base table/RLS to migration; replace broad FOR ALL policy with explicit own insert/delete and verify grants"
"review_images","reviews/storage","reviews API: read/insert/update/delete; tests","partial","id; review_id; user_id; storage_path; public_url; status; sort_order; original_name; file_size_kb/size_bytes; mime_type; width; height; moderation_note; moderated_at; moderated_by; created_at; updated_at","review_id; status; storage_path; user_id","unique storage_path recommended; sort_order uniqueness per review optional","review_id -> reviews(id); user_id -> auth.users(id)","yes","approved public select; own insert/delete; admin moderation via server","Base only in root SQL; migration only adds updated_at/triggers; code contains legacy missing-column retry","P0","Create canonical migration from verified live schema; verify bucket review-images, RLS, storage policies, columns and moderation actor type"
"reviews","reviews","reviews API: public/own/admin read/write/delete","partial","id; product_slug; user_id; user_display_name; user_email; title; body; rating; helpful_count; approved; status; verified_purchase; order_id; moderation fields; is_edited; created_at; updated_at","product_slug,status,created_at; user_id; verified_purchase","unique(user_id,product_slug)","user_id -> auth.users(id); order_id -> orders(id)","yes","approved public select; own insert/update/delete as designed; admin through server","Base only in root SQL; migration only adds updated_at/status trigger","P0","Promote exact base schema/RLS; remove hard-coded auth.email admin policy; verify FK/checks and direct-delete policy"
"shipment_events","shipments","admin orders: read/insert","yes","id; shipment_id; order_id; event_type; status; note; occurred_at; provider_event_code; raw_payload; metadata","shipment_id,occurred_at; order_id,occurred_at","provider event idempotency key recommended","shipment_id -> shipments(id); order_id -> orders(id)","yes","server-only; own read via order if exposed","Created before blanket hardening and included in it","P1","Verify FK/index/idempotency and RLS/revokes"
"shipments","shipments","commerce/account/admin/tracking/DHL paths: read/write","partial","id; order_id; status; carrier/carrier_name; tracking_number; tracking_url; provider; provider_shipment_id; label fields; package dimensions; sender/recipient snapshots; provider payload/response; direction; error_message; shipped_at; delivered_at; created_at; updated_at","order_id,created_at desc; order_id,status,created_at; provider_shipment_id; tracking_number","provider_shipment_id uniqueness where non-null","order_id -> orders(id) on delete cascade","yes","server-only writes; own read through order","Migrations only ALTER shipments; base CREATE TABLE exists only in root schema/commerce-schema","P0","Add canonical base provenance after live verification; verify status values, FKs, uniqueness, RLS/revokes"
"shipping_events","shipments","functions/api/shipping/track.js: read","yes","id; shipment_id; order_id; status; location; message; event_at; provider_event_code; raw_payload; created_at","order_id,event_at desc; shipment_id,event_at desc","provider event idempotency key recommended","shipment_id -> shipments(id); order_id -> orders(id)","yes","server-only; safe customer projection through API","Created in 20260626 after blanket hardening; no RLS/policy found","P0","Verify live RLS/grants/FKs/index and provider event uniqueness"
"shipping_settings","shipments","supporting provider configuration object","yes","id; provider; is_active; package defaults; cutoff_time; sender_reference; service_code; label_format; metadata; created_at; updated_at","provider,is_active","one active row/provider recommended","none","yes","server-only","Created after blanket hardening; no RLS/grant block found","P1","Verify exposure and unique active-provider configuration"
"supplier_records","inventory/compliance","admin suppliers: read/write","yes","id; name; contact_email; contact_phone; website; notes; created_at; updated_at","name","normalized supplier name or external id if needed","none","yes","server-only","Created before blanket hardening and included in it","P1","Verify RLS/revokes and supplier identity uniqueness"
"support_requests","support","account/summary.js and account/support-requests.js: read/insert","no","id; user_id; customer_email; order_id; category; subject; message; status; assigned_to; resolution; created_at; updated_at","user_id,created_at desc; order_id; status,created_at","ticket/reference number unique if exposed","user_id -> auth.users(id); order_id -> orders(id)","yes","own select/insert; server/admin update","No CREATE/ALTER reference anywhere under supabase SQL","P0","Verify live existence immediately; design canonical table/RLS/index migration from actual production schema"
"user_addresses","account/addresses","account/addresses.js and summary.js: CRUD/read","yes","id; user_id; title; recipient names; phone; city; district; neighborhood; postal_code; address_line; address_type; is_default; metadata; created_at; updated_at","user_id; user_id,is_default,updated_at; normalized location optional","one default per user+address_type partial unique","user_id -> auth.users(id) on delete cascade","yes","own select/insert/update/delete","Clear migration provenance and explicit authenticated grant in final migrations","P0","Verify one-default constraint, ownership policies/TO roles, grants, and no cross-user default races"
"user_favorites","favorites/wishlist","account/favorites.js and summary.js: CRUD/read; E1 tests","out-of-band","id; user_id; product_id; product_slug; product_name; brand; image; price; metadata; created_at; updated_at","user_id; product_slug; user_id,created_at desc","unique(user_id,product_slug)","user_id -> auth.users(id) on delete cascade","yes","own select/insert/update/delete","Defined only in root schema/commerce-schema; no migration file","P0","Verify live table/columns/unique/RLS/policies/duplicates; then promote exact schema to migration"
"customer_addresses","account alias","requested audit name; runtime uses user_addresses","no","n/a; canonical candidate is user_addresses","n/a","n/a","n/a","n/a","n/a","No code or migration reference","P2","Document alias and avoid creating duplicate table unless business model changes"
"customer_profiles","account alias","requested audit name; runtime uses profiles plus customer_skin_profiles","no","n/a; canonical identity profile is profiles","n/a","n/a","n/a","n/a","n/a","No code or migration reference","P2","Document crosswalk and prevent a third profile source"
"newsletter_subscriptions","CRM alias","requested audit name; runtime uses newsletter_subscribers","no","n/a","n/a","n/a","n/a","n/a","n/a","No code or migration reference","P2","Keep newsletter_subscribers as canonical name and document it"
"refund_items","refunds alias/gap","requested audit object; runtime stores return items and refund item breakdown in refund_records.metadata","no","refund_id; order_item_id; quantity; paid snapshot; refunded amount; created_at if normalized later","refund_id; order_item_id","idempotent refund+line identity","refund_id -> refund_records; order_item_id -> order_items","yes","server-only","No table; item scope currently JSONB metadata plus return_request_items","P1","Decide whether normalized refund_items is required for audit/accounting before provider refunds"
